{
  "$schema": "https://json-schema.org/draft/2020-12/schema",
  "$id": "https://stillsuit.local/schemas/theme.v2.json",
  "title": "Stillsuit theme v2",
  "description": "Production theme contract. Palette tokens feed semantic roles; shared components consume semantic and component assignments, never raw palette values.",
  "type": "object",
  "additionalProperties": false,
  "required": [
    "schemaVersion",
    "identity",
    "palette",
    "semantic",
    "component",
    "typography",
    "metrics",
    "motion",
    "effects"
  ],
  "properties": {
    "schemaVersion": {
      "const": 2
    },
    "identity": {
      "type": "object",
      "additionalProperties": false,
      "required": [
        "id",
        "name",
        "mode",
        "description"
      ],
      "properties": {
        "id": {
          "type": "string",
          "pattern": "^stillsuit\\.[a-z][a-z0-9-]*$"
        },
        "name": {
          "type": "string",
          "minLength": 1,
          "maxLength": 80
        },
        "mode": {
          "enum": [
            "dark",
            "light"
          ]
        },
        "description": {
          "type": "string",
          "minLength": 1,
          "maxLength": 240
        }
      }
    },
    "palette": {
      "type": "object",
      "additionalProperties": false,
      "required": [
        "neutral",
        "chromatic"
      ],
      "properties": {
        "neutral": {
          "type": "object",
          "minProperties": 6,
          "additionalProperties": {
            "$ref": "#/$defs/color"
          }
        },
        "chromatic": {
          "type": "object",
          "minProperties": 6,
          "additionalProperties": {
            "$ref": "#/$defs/color"
          }
        }
      }
    },
    "semantic": {
      "type": "object",
      "additionalProperties": false,
      "required": [
        "background",
        "surface",
        "content",
        "outline",
        "accent",
        "status",
        "signal",
        "intensity"
      ],
      "properties": {
        "background": {
          "$ref": "#/$defs/backgroundSemantic"
        },
        "surface": {
          "$ref": "#/$defs/surfaceSemantic"
        },
        "content": {
          "$ref": "#/$defs/contentSemantic"
        },
        "outline": {
          "$ref": "#/$defs/outlineSemantic"
        },
        "accent": {
          "$ref": "#/$defs/accentSemantic"
        },
        "status": {
          "$ref": "#/$defs/statusSemantic"
        },
        "signal": {
          "$ref": "#/$defs/signalSemantic"
        },
        "intensity": {
          "$ref": "#/$defs/intensitySemantic"
        }
      }
    },
    "component": {
      "type": "object",
      "additionalProperties": false,
      "required": [
        "bar",
        "panel",
        "control",
        "notification",
        "osd"
      ],
      "properties": {
        "bar": {
          "$ref": "#/$defs/barComponent"
        },
        "panel": {
          "$ref": "#/$defs/panelComponent"
        },
        "control": {
          "$ref": "#/$defs/controlComponent"
        },
        "notification": {
          "$ref": "#/$defs/notificationComponent"
        },
        "osd": {
          "$ref": "#/$defs/osdComponent"
        }
      }
    },
    "typography": {
      "type": "object",
      "additionalProperties": false,
      "required": [
        "bodyFamily",
        "monoFamily",
        "iconFamily",
        "baseSize",
        "captionSize",
        "headingSize",
        "weightRegular",
        "weightMedium",
        "weightBold"
      ],
      "properties": {
        "bodyFamily": {
          "type": "string",
          "minLength": 1
        },
        "monoFamily": {
          "type": "string",
          "minLength": 1
        },
        "iconFamily": {
          "type": "string",
          "minLength": 1
        },
        "baseSize": {
          "type": "number",
          "minimum": 9,
          "maximum": 24
        },
        "captionSize": {
          "type": "number",
          "minimum": 8,
          "maximum": 20
        },
        "headingSize": {
          "type": "number",
          "minimum": 10,
          "maximum": 32
        },
        "weightRegular": {
          "$ref": "#/$defs/fontWeight"
        },
        "weightMedium": {
          "$ref": "#/$defs/fontWeight"
        },
        "weightBold": {
          "$ref": "#/$defs/fontWeight"
        }
      }
    },
    "metrics": {
      "type": "object",
      "additionalProperties": false,
      "required": [
        "spaceUnit",
        "radiusSmall",
        "radiusMedium",
        "radiusLarge",
        "barHeight",
        "barOuterGap",
        "barInnerGap",
        "iconSmall",
        "iconMedium",
        "iconLarge",
        "panelWidth",
        "panelPadding",
        "rowHeight"
      ],
      "properties": {
        "spaceUnit": {
          "$ref": "#/$defs/nonNegativeNumber"
        },
        "radiusSmall": {
          "$ref": "#/$defs/nonNegativeNumber"
        },
        "radiusMedium": {
          "$ref": "#/$defs/nonNegativeNumber"
        },
        "radiusLarge": {
          "$ref": "#/$defs/nonNegativeNumber"
        },
        "barHeight": {
          "type": "number",
          "minimum": 20,
          "maximum": 64
        },
        "barOuterGap": {
          "$ref": "#/$defs/nonNegativeNumber"
        },
        "barInnerGap": {
          "$ref": "#/$defs/nonNegativeNumber"
        },
        "iconSmall": {
          "$ref": "#/$defs/positiveNumber"
        },
        "iconMedium": {
          "$ref": "#/$defs/positiveNumber"
        },
        "iconLarge": {
          "$ref": "#/$defs/positiveNumber"
        },
        "panelWidth": {
          "$ref": "#/$defs/positiveNumber"
        },
        "panelPadding": {
          "$ref": "#/$defs/nonNegativeNumber"
        },
        "rowHeight": {
          "$ref": "#/$defs/positiveNumber"
        }
      }
    },
    "motion": {
      "type": "object",
      "additionalProperties": false,
      "required": [
        "fast",
        "normal",
        "slow",
        "distanceSmall",
        "distanceMedium",
        "easing"
      ],
      "properties": {
        "fast": {
          "$ref": "#/$defs/duration"
        },
        "normal": {
          "$ref": "#/$defs/duration"
        },
        "slow": {
          "$ref": "#/$defs/duration"
        },
        "distanceSmall": {
          "$ref": "#/$defs/nonNegativeNumber"
        },
        "distanceMedium": {
          "$ref": "#/$defs/nonNegativeNumber"
        },
        "easing": {
          "enum": [
            "out-cubic",
            "out-quart",
            "out-expo"
          ]
        }
      }
    },
    "effects": {
      "type": "object",
      "additionalProperties": false,
      "required": [
        "surfaceOpacity",
        "blurEnabled",
        "blurRadius",
        "shadowOpacity"
      ],
      "properties": {
        "surfaceOpacity": {
          "type": "number",
          "minimum": 0,
          "maximum": 1
        },
        "blurEnabled": {
          "type": "boolean"
        },
        "blurRadius": {
          "$ref": "#/$defs/nonNegativeNumber"
        },
        "shadowOpacity": {
          "type": "number",
          "minimum": 0,
          "maximum": 1
        }
      }
    }
  },
  "$defs": {
    "color": {
      "type": "string",
      "pattern": "^#[0-9a-fA-F]{6}$"
    },
    "backgroundSemantic": {
      "type": "object",
      "additionalProperties": false,
      "required": [
        "canvas",
        "desktop",
        "scrim"
      ],
      "properties": {
        "canvas": {
          "$ref": "#/$defs/color"
        },
        "desktop": {
          "$ref": "#/$defs/color"
        },
        "scrim": {
          "$ref": "#/$defs/color"
        }
      }
    },
    "surfaceSemantic": {
      "type": "object",
      "additionalProperties": false,
      "required": [
        "bar",
        "panel",
        "raised",
        "overlay",
        "hover",
        "pressed",
        "selected",
        "danger"
      ],
      "properties": {
        "bar": {
          "$ref": "#/$defs/color"
        },
        "panel": {
          "$ref": "#/$defs/color"
        },
        "raised": {
          "$ref": "#/$defs/color"
        },
        "overlay": {
          "$ref": "#/$defs/color"
        },
        "hover": {
          "$ref": "#/$defs/color"
        },
        "pressed": {
          "$ref": "#/$defs/color"
        },
        "selected": {
          "$ref": "#/$defs/color"
        },
        "danger": {
          "$ref": "#/$defs/color"
        }
      }
    },
    "contentSemantic": {
      "type": "object",
      "additionalProperties": false,
      "required": [
        "primary",
        "secondary",
        "muted",
        "disabled",
        "inverse"
      ],
      "properties": {
        "primary": {
          "$ref": "#/$defs/color"
        },
        "secondary": {
          "$ref": "#/$defs/color"
        },
        "muted": {
          "$ref": "#/$defs/color"
        },
        "disabled": {
          "$ref": "#/$defs/color"
        },
        "inverse": {
          "$ref": "#/$defs/color"
        }
      }
    },
    "outlineSemantic": {
      "type": "object",
      "additionalProperties": false,
      "required": [
        "subtle",
        "default",
        "strong",
        "focus"
      ],
      "properties": {
        "subtle": {
          "$ref": "#/$defs/color"
        },
        "default": {
          "$ref": "#/$defs/color"
        },
        "strong": {
          "$ref": "#/$defs/color"
        },
        "focus": {
          "$ref": "#/$defs/color"
        }
      }
    },
    "accentSemantic": {
      "type": "object",
      "additionalProperties": false,
      "required": [
        "primary",
        "hover",
        "pressed",
        "subtle",
        "onAccent"
      ],
      "properties": {
        "primary": {
          "$ref": "#/$defs/color"
        },
        "hover": {
          "$ref": "#/$defs/color"
        },
        "pressed": {
          "$ref": "#/$defs/color"
        },
        "subtle": {
          "$ref": "#/$defs/color"
        },
        "onAccent": {
          "$ref": "#/$defs/color"
        }
      }
    },
    "statusSemantic": {
      "type": "object",
      "additionalProperties": false,
      "required": [
        "info",
        "success",
        "warning",
        "danger"
      ],
      "properties": {
        "info": {
          "$ref": "#/$defs/color"
        },
        "success": {
          "$ref": "#/$defs/color"
        },
        "warning": {
          "$ref": "#/$defs/color"
        },
        "danger": {
          "$ref": "#/$defs/color"
        }
      }
    },
    "signalSemantic": {
      "type": "object",
      "additionalProperties": false,
      "required": [
        "audio",
        "microphone",
        "brightness",
        "charging",
        "recording"
      ],
      "properties": {
        "audio": {
          "$ref": "#/$defs/color"
        },
        "microphone": {
          "$ref": "#/$defs/color"
        },
        "brightness": {
          "$ref": "#/$defs/color"
        },
        "charging": {
          "$ref": "#/$defs/color"
        },
        "recording": {
          "$ref": "#/$defs/color"
        }
      }
    },
    "barComponent": {
      "type": "object",
      "required": [
        "background",
        "border",
        "separator",
        "workspaceIdle",
        "workspaceActive",
        "clusterHover",
        "clusterActive",
        "clusterText",
        "clusterActiveText"
      ],
      "additionalProperties": false,
      "properties": {
        "background": {
          "$ref": "#/$defs/color"
        },
        "border": {
          "$ref": "#/$defs/color"
        },
        "separator": {
          "$ref": "#/$defs/color"
        },
        "workspaceIdle": {
          "$ref": "#/$defs/color"
        },
        "workspaceActive": {
          "$ref": "#/$defs/color"
        },
        "clusterHover": {
          "$ref": "#/$defs/color"
        },
        "clusterActive": {
          "$ref": "#/$defs/color"
        },
        "clusterText": {
          "$ref": "#/$defs/color"
        },
        "clusterActiveText": {
          "$ref": "#/$defs/color"
        }
      }
    },
    "panelComponent": {
      "type": "object",
      "additionalProperties": false,
      "required": [
        "background",
        "border",
        "section",
        "rowHover",
        "rowSelected",
        "rowDanger",
        "shadow"
      ],
      "properties": {
        "background": {
          "$ref": "#/$defs/color"
        },
        "border": {
          "$ref": "#/$defs/color"
        },
        "section": {
          "$ref": "#/$defs/color"
        },
        "rowHover": {
          "$ref": "#/$defs/color"
        },
        "rowSelected": {
          "$ref": "#/$defs/color"
        },
        "rowDanger": {
          "$ref": "#/$defs/color"
        },
        "shadow": {
          "$ref": "#/$defs/color"
        }
      }
    },
    "controlComponent": {
      "type": "object",
      "additionalProperties": false,
      "required": [
        "background",
        "hover",
        "pressed",
        "active",
        "disabled",
        "outline",
        "focus",
        "text",
        "textDisabled",
        "onActive"
      ],
      "properties": {
        "background": {
          "$ref": "#/$defs/color"
        },
        "hover": {
          "$ref": "#/$defs/color"
        },
        "pressed": {
          "$ref": "#/$defs/color"
        },
        "active": {
          "$ref": "#/$defs/color"
        },
        "disabled": {
          "$ref": "#/$defs/color"
        },
        "outline": {
          "$ref": "#/$defs/color"
        },
        "focus": {
          "$ref": "#/$defs/color"
        },
        "text": {
          "$ref": "#/$defs/color"
        },
        "textDisabled": {
          "$ref": "#/$defs/color"
        },
        "onActive": {
          "$ref": "#/$defs/color"
        }
      }
    },
    "notificationComponent": {
      "type": "object",
      "additionalProperties": false,
      "required": [
        "background",
        "border",
        "unread",
        "info",
        "success",
        "warning",
        "danger",
        "muted"
      ],
      "properties": {
        "background": {
          "$ref": "#/$defs/color"
        },
        "border": {
          "$ref": "#/$defs/color"
        },
        "unread": {
          "$ref": "#/$defs/color"
        },
        "info": {
          "$ref": "#/$defs/color"
        },
        "success": {
          "$ref": "#/$defs/color"
        },
        "warning": {
          "$ref": "#/$defs/color"
        },
        "danger": {
          "$ref": "#/$defs/color"
        },
        "muted": {
          "$ref": "#/$defs/color"
        }
      }
    },
    "osdComponent": {
      "type": "object",
      "additionalProperties": false,
      "required": [
        "border",
        "track",
        "fill",
        "text"
      ],
      "properties": {
        "border": {
          "$ref": "#/$defs/color"
        },
        "track": {
          "$ref": "#/$defs/color"
        },
        "fill": {
          "$ref": "#/$defs/color"
        },
        "text": {
          "$ref": "#/$defs/color"
        }
      }
    },
    "fontWeight": {
      "type": "integer",
      "minimum": 1,
      "maximum": 1000
    },
    "nonNegativeNumber": {
      "type": "number",
      "minimum": 0
    },
    "positiveNumber": {
      "type": "number",
      "exclusiveMinimum": 0
    },
    "duration": {
      "type": "integer",
      "minimum": 0,
      "maximum": 2000
    },
    "intensitySemantic": {
      "type": "object",
      "additionalProperties": false,
      "required": [
        "normal",
        "elevated",
        "high",
        "critical"
      ],
      "properties": {
        "normal": {
          "$ref": "#/$defs/color"
        },
        "elevated": {
          "$ref": "#/$defs/color"
        },
        "high": {
          "$ref": "#/$defs/color"
        },
        "critical": {
          "$ref": "#/$defs/color"
        }
      }
    }
  }
}
